{
  "event_types": [
    "brake_onset",
    "steering_torque_peak",
    "pit_transition"
  ],
  "events": [
    {
      "event_type": "brake_onset",
      "evidence": {
        "label": "derived",
        "measured_channels": [
          "Brake"
        ],
        "method": "synthetic native-record detector example"
      },
      "lap": 8,
      "lap_distance_fraction": 0.16,
      "lap_distance_pct": 16.0,
      "measurements": {
        "channel": "Brake",
        "channels": [
          "Brake"
        ],
        "threshold": 0.05,
        "value": 0.12
      },
      "session_time_s": 20.0,
      "source_path": "%IRACING_ROOT%\\telemetry\\synthetic-entry-a.ibt",
      "source_record_index": 1200,
      "source_sha256": "aaaaaaaaaaaaaaaaaaaaaaaaaaaaaaaaaaaaaaaaaaaaaaaaaaaaaaaaaaaaaaaa"
    },
    {
      "event_type": "steering_torque_peak",
      "evidence": {
        "label": "derived",
        "measured_channels": [
          "SteeringWheelTorque_ST"
        ],
        "method": "synthetic native-record detector example"
      },
      "lap": 8,
      "lap_distance_fraction": 0.24,
      "lap_distance_pct": 24.0,
      "measurements": {
        "channel": "SteeringWheelTorque_ST",
        "channels": [
          "SteeringWheelTorque_ST"
        ],
        "value": 18.2
      },
      "session_time_s": 21.333333,
      "source_path": "%IRACING_ROOT%\\telemetry\\synthetic-entry-a.ibt",
      "source_record_index": 1280,
      "source_sha256": "aaaaaaaaaaaaaaaaaaaaaaaaaaaaaaaaaaaaaaaaaaaaaaaaaaaaaaaaaaaaaaaa"
    },
    {
      "event_type": "pit_transition",
      "evidence": {
        "label": "measured",
        "measured_channels": [
          "OnPitRoad"
        ],
        "method": "synthetic native-record detector example"
      },
      "lap": 31,
      "lap_distance_fraction": 0.94,
      "lap_distance_pct": 94.0,
      "measurements": {
        "channel": "OnPitRoad",
        "channels": [
          "OnPitRoad"
        ],
        "from": false,
        "to": true
      },
      "session_time_s": 83.333333,
      "source_path": "%IRACING_ROOT%\\telemetry\\synthetic-entry-a.ibt",
      "source_record_index": 5000,
      "source_sha256": "aaaaaaaaaaaaaaaaaaaaaaaaaaaaaaaaaaaaaaaaaaaaaaaaaaaaaaaaaaaaaaaa"
    }
  ],
  "evidence_rule": "Brake, pit, torque, and shock events are derived from measured SDK channels; wheel-speed divergence remains a calibrated diagnostic proxy, not proof of lock, spin, wear, or setup cause.",
  "filters": {
    "lap": null,
    "lap_distance_end": null,
    "lap_distance_start": null,
    "session_time_end": null,
    "session_time_start": null
  },
  "max_events": 3,
  "ok": true,
  "record_bounds_semantics": "per source; start inclusive, end exclusive",
  "selection": {
    "car_id": 9002,
    "car_path": "synthetic test car",
    "end_time_unix": 1785589200.0,
    "end_time_utc": "2026-08-01T13:00:00+00:00",
    "event_type": "Race",
    "file_count": 2,
    "files": [
      "%IRACING_ROOT%\\telemetry\\synthetic-entry-a.ibt",
      "%IRACING_ROOT%\\telemetry\\synthetic-entry-b.ibt"
    ],
    "group_id": "subsession:8001:1",
    "is_fixed_setup": false,
    "is_race": true,
    "kind": "session",
    "latest_mtime_unix": 1785589201.0,
    "season_id": 202603,
    "selector": "8001",
    "selector_type": "subsession_id",
    "series_id": 9003,
    "session_id": 7001,
    "session_unique_id": 3,
    "sim_session_num": 1,
    "sim_session_type": "Race",
    "start_time_unix": 1785585600.0,
    "start_time_utc": "2026-08-01T12:00:00+00:00",
    "subsession_id": 8001,
    "time_source": "disk_header",
    "track_config_name": "Oval",
    "track_id": 9001,
    "track_name": "Synthetic Speedway",
    "valid": true
  },
  "selection_mode": "severity",
  "source_fingerprints": [
    {
      "modified_ns": 1785589201000000000,
      "path": "%IRACING_ROOT%\\telemetry\\synthetic-entry-a.ibt",
      "sha256": "aaaaaaaaaaaaaaaaaaaaaaaaaaaaaaaaaaaaaaaaaaaaaaaaaaaaaaaaaaaaaaaa",
      "size": 288000
    }
  ],
  "sources": [
    {
      "cache_hit": false,
      "cache_path": "%ARCHIVE_ROOT%\\telemetry-events\\fixture.json",
      "coverage": {
        "brake_onset": {
          "channels_used": [
            "Brake"
          ],
          "status": "enabled"
        },
        "pit_transition": {
          "channels_used": [
            "OnPitRoad"
          ],
          "status": "enabled"
        },
        "steering_torque_peak": {
          "channels_used": [
            "SteeringWheelTorque_ST"
          ],
          "status": "enabled"
        }
      },
      "events": [
        {
          "event_type": "brake_onset",
          "evidence": {
            "label": "derived",
            "measured_channels": [
              "Brake"
            ],
            "method": "synthetic native-record detector example"
          },
          "lap": 8,
          "lap_distance_fraction": 0.16,
          "lap_distance_pct": 16.0,
          "measurements": {
            "channel": "Brake",
            "channels": [
              "Brake"
            ],
            "threshold": 0.05,
            "value": 0.12
          },
          "session_time_s": 20.0,
          "source_path": "%IRACING_ROOT%\\telemetry\\synthetic-entry-a.ibt",
          "source_record_index": 1200,
          "source_sha256": "aaaaaaaaaaaaaaaaaaaaaaaaaaaaaaaaaaaaaaaaaaaaaaaaaaaaaaaaaaaaaaaa"
        },
        {
          "event_type": "steering_torque_peak",
          "evidence": {
            "label": "derived",
            "measured_channels": [
              "SteeringWheelTorque_ST"
            ],
            "method": "synthetic native-record detector example"
          },
          "lap": 8,
          "lap_distance_fraction": 0.24,
          "lap_distance_pct": 24.0,
          "measurements": {
            "channel": "SteeringWheelTorque_ST",
            "channels": [
              "SteeringWheelTorque_ST"
            ],
            "value": 18.2
          },
          "session_time_s": 21.333333,
          "source_path": "%IRACING_ROOT%\\telemetry\\synthetic-entry-a.ibt",
          "source_record_index": 1280,
          "source_sha256": "aaaaaaaaaaaaaaaaaaaaaaaaaaaaaaaaaaaaaaaaaaaaaaaaaaaaaaaaaaaaaaaa"
        },
        {
          "event_type": "pit_transition",
          "evidence": {
            "label": "measured",
            "measured_channels": [
              "OnPitRoad"
            ],
            "method": "synthetic native-record detector example"
          },
          "lap": 31,
          "lap_distance_fraction": 0.94,
          "lap_distance_pct": 94.0,
          "measurements": {
            "channel": "OnPitRoad",
            "channels": [
              "OnPitRoad"
            ],
            "from": false,
            "to": true
          },
          "session_time_s": 83.333333,
          "source_path": "%IRACING_ROOT%\\telemetry\\synthetic-entry-a.ibt",
          "source_record_index": 5000,
          "source_sha256": "aaaaaaaaaaaaaaaaaaaaaaaaaaaaaaaaaaaaaaaaaaaaaaaaaaaaaaaaaaaaaaaa"
        }
      ],
      "globally_returned_event_count": 3,
      "source_path": "%IRACING_ROOT%\\telemetry\\synthetic-entry-a.ibt",
      "source_sha256": "aaaaaaaaaaaaaaaaaaaaaaaaaaaaaaaaaaaaaaaaaaaaaaaaaaaaaaaaaaaaaaaa",
      "summary": {
        "candidate_counts_by_type": {
          "brake_onset": 4,
          "pit_transition": 2,
          "steering_torque_peak": 2
        },
        "candidate_event_count": 8,
        "candidate_event_count_complete": true,
        "counts_by_type": {
          "brake_onset": 1,
          "pit_transition": 1,
          "steering_torque_peak": 1
        },
        "omitted_event_count": 5,
        "requested_record_count": 6000,
        "returned_event_count": 3,
        "returned_order": "balanced severity ranking",
        "scan_complete": true,
        "scanned_record_count": 6000,
        "selection_mode": "severity",
        "truncated": true,
        "wheel_baseline_completed_laps": 0
      }
    }
  ],
  "summary": {
    "candidate_counts_by_type": {
      "brake_onset": 4,
      "pit_transition": 2,
      "steering_torque_peak": 2
    },
    "candidate_event_count": 8,
    "candidate_event_count_complete": true,
    "counts_by_type": {
      "brake_onset": 1,
      "pit_transition": 1,
      "steering_torque_peak": 1
    },
    "omitted_event_count": 5,
    "returned_event_count": 3,
    "scan_complete": true,
    "selection_mode": "severity",
    "source_count": 1,
    "truncated": true
  }
}
